{
  "schema_version": 1,
  "run_id": "3f2b8c1e-9a4d-4e6f-8b2a-1c5d7e9f0a3b",
  "project_id": "aaaaaaaaaaaaaaaaaaaaaaaaaaaaaaaaaaaaaaaaaaaaaaaaaaaaaaaaaaaaaaaa",
  "id_source": "local",
  "scanner_version": "0.1.8",
  "started_at": "2026-10-01T10:00:00Z",
  "finished_at": "2026-10-01T10:00:42Z",
  "scan_status": "partial",
  "coverage": {
    "files_scanned": 0,
    "files_skipped": 10000000,
    "skips_by_reason": {
      "timeout": 5000000,
      "unreadable": 5000000
    },
    "dependency_lookup": "offline"
  },
  "findings": [
    {
      "rule_id": "r1",
      "severity": "info",
      "kind": "sast",
      "count": 10000000
    }
  ],
  "environment": "local"
}
